{
  "fixture_format": "decision-fixture-set/1.0.0",
  "generated_at": "2026-09-20T18:32:58.570131Z",
  "recorded_provider": "semif",
  "records": {
    "sha256:4cf1fedf3142c4b49008bd4803591f64827fd528d2e707e883d650e69c315bcf": {
      "answers": {
        "actionable_feedback": {
          "noul": 0.9971990730328789,
          "type": "noul"
        },
        "defect_type": {
          "choice": "unclear",
          "confidence": 0.9247351467062843,
          "probabilities": {
            "compatibility": 0.0009555266434660798,
            "missing_component": 0.00039832276645189604,
            "noise": 0.05216998704062775,
            "other": 0.006230816406698468,
            "physical_damage": 0.000744164898176974,
            "stability": 0.0015753971018032235,
            "thermal": 0.013190638436491183,
            "unclear": 0.9247351467062843
          },
          "type": "choice"
        },
        "delivery_experience": {
          "confidence": 0.6865833918889007,
          "legend": {
            "0": "strongly_negative",
            "1": "negative",
            "2": "neutral_mixed_unclear",
            "3": "positive",
            "4": "strongly_positive"
          },
          "probabilities": {
            "0": 0.07236535710214474,
            "1": 0.6865833918889007,
            "2": 0.17359546729144149,
            "3": 0.05635819677839218,
            "4": 0.011097586939120815
          },
          "score": 1.2472392645634436,
          "type": "score"
        },
        "explicit_repurchase_risk": {
          "noul": 0.04742587317756679,
          "type": "noul"
        },
        "issue_severity": {
          "confidence": 0.957865940961058,
          "legend": {
            "0": "none",
            "1": "minor_inconvenience",
            "2": "materially_impaired",
            "3": "unusable_serious"
          },
          "probabilities": {
            "0": 0.019879873376415128,
            "1": 0.957865940961058,
            "2": 0.019879873376415128,
            "3": 0.002374312286111792
          },
          "score": 1.0047486245722237,
          "type": "score"
        },
        "mentions_delivery": {
          "noul": 0.9975273768433653,
          "type": "noul"
        },
        "mentions_product": {
          "noul": 0.6224593312018546,
          "type": "noul"
        },
        "mentions_support": {
          "noul": 0.007577241267860811,
          "type": "noul"
        },
        "overall_experience": {
          "confidence": 0.4641565683246285,
          "legend": {
            "0": "strongly_negative",
            "1": "negative",
            "2": "neutral_mixed_unclear",
            "3": "positive",
            "4": "strongly_positive"
          },
          "probabilities": {
            "0": 0.09139784742583255,
            "1": 0.4641565683246285,
            "2": 0.029672536678038527,
            "3": 0.4096167338607798,
            "4": 0.005156313710720726
          },
          "score": 1.7729770981059276,
          "type": "score"
        },
        "primary_topic": {
          "choice": "delivery",
          "confidence": 0.8401067288712265,
          "probabilities": {
            "compatibility": 0.04739557841406117,
            "delivery": 0.8401067288712265,
            "other": 0.03257447290608107,
            "price_value": 8.074404561970777e-05,
            "product_information": 5.549451688063431e-05,
            "product_quality": 0.0781420982683985,
            "returns_refunds": 0.00024870916976763003,
            "support": 0.001263049382469185,
            "website_checkout": 0.0001331244254955937
          },
          "type": "choice"
        },
        "product_experience": {
          "confidence": 0.8118891534031573,
          "legend": {
            "0": "strongly_negative",
            "1": "negative",
            "2": "neutral_mixed_unclear",
            "3": "positive",
            "4": "strongly_positive"
          },
          "probabilities": {
            "0": 0.058813053011268816,
            "1": 0.045803651739996204,
            "2": 0.8118891534031573,
            "3": 0.06664392003985652,
            "4": 0.016850221805721165
          },
          "score": 1.936914605888765,
          "type": "score"
        },
        "reports_product_defect": {
          "noul": 0.009708476481474066,
          "type": "noul"
        },
        "resolution_status": {
          "choice": "unresolved",
          "confidence": 0.5554330215191877,
          "probabilities": {
            "not_applicable": 0.04559271880707048,
            "partially_resolved": 0.20433238956464447,
            "resolved": 0.03550764510930085,
            "unclear": 0.15913422499979646,
            "unresolved": 0.5554330215191877
          },
          "type": "choice"
        },
        "support_experience": {
          "confidence": 0.7584891580362486,
          "legend": {
            "0": "strongly_negative",
            "1": "negative",
            "2": "neutral_mixed_unclear",
            "3": "positive",
            "4": "strongly_positive"
          },
          "probabilities": {
            "0": 0.07994416909560197,
            "1": 0.13180565205636682,
            "2": 0.7584891580362486,
            "3": 0.02021305140107831,
            "4": 0.009547969410704299
          },
          "score": 1.7476149999749162,
          "type": "score"
        }
      }
    },
    "sha256:54b537b412dac6e69f05c5343b4f55e0359d9b47d469265b03e20e1a1a315f8b": {
      "answers": {
        "actionable_feedback": {
          "noul": 0.9940889311437562,
          "type": "noul"
        },
        "defect_type": {
          "choice": "unclear",
          "confidence": 0.9672072439097191,
          "probabilities": {
            "compatibility": 0.00047208925525372536,
            "missing_component": 0.00025269116915557527,
            "noise": 0.017715018610018254,
            "other": 0.002397467061128686,
            "physical_damage": 0.0006061746026909703,
            "stability": 0.0018671492245949202,
            "thermal": 0.009482166167438869,
            "unclear": 0.9672072439097191
          },
          "type": "choice"
        },
        "delivery_experience": {
          "confidence": 0.9917881413541777,
          "legend": {
            "0": "strongly_negative",
            "1": "negative",
            "2": "neutral_mixed_unclear",
            "3": "positive",
            "4": "strongly_positive"
          },
          "probabilities": {
            "0": 0.005897387860063411,
            "1": 0.0014910931628422514,
            "2": 0.9917881413541777,
            "3": 0.00020179751552543276,
            "4": 0.0006215801073912359
          },
          "score": 1.9881590888473388,
          "type": "score"
        },
        "explicit_repurchase_risk": {
          "noul": 0.053403329799824234,
          "type": "noul"
        },
        "issue_severity": {
          "confidence": 0.46323576537301625,
          "legend": {
            "0": "none",
            "1": "minor_inconvenience",
            "2": "materially_impaired",
            "3": "unusable_serious"
          },
          "probabilities": {
            "0": 0.06269214351208623,
            "1": 0.2809666943741822,
            "2": 0.46323576537301625,
            "3": 0.1931053967407152
          },
          "score": 1.7867544153423602,
          "type": "score"
        },
        "mentions_delivery": {
          "noul": 0.004609572179374208,
          "type": "noul"
        },
        "mentions_product": {
          "noul": 0.04742587317756679,
          "type": "noul"
        },
        "mentions_support": {
          "noul": 0.0675466911396291,
          "type": "noul"
        },
        "overall_experience": {
          "confidence": 0.9637806720339441,
          "legend": {
            "0": "strongly_negative",
            "1": "negative",
            "2": "neutral_mixed_unclear",
            "3": "positive",
            "4": "strongly_positive"
          },
          "probabilities": {
            "0": 0.017652258756915267,
            "1": 0.9637806720339441,
            "2": 0.015578063676599524,
            "3": 0.0018605343847442487,
            "4": 0.0011284711477969676
          },
          "score": 1.0050322871325639,
          "type": "score"
        },
        "primary_topic": {
          "choice": "returns_refunds",
          "confidence": 0.9954051392329549,
          "probabilities": {
            "compatibility": 0.0005505430244745755,
            "delivery": 0.0001577332173898829,
            "other": 0.0010285497798671348,
            "price_value": 1.8838546347133474e-05,
            "product_information": 1.2163079689070276e-05,
            "product_quality": 0.002467362655538567,
            "returns_refunds": 0.9954051392329549,
            "support": 0.00033392122383475275,
            "website_checkout": 2.5749239903823058e-05
          },
          "type": "choice"
        },
        "product_experience": {
          "confidence": 0.9948391718040579,
          "legend": {
            "0": "strongly_negative",
            "1": "negative",
            "2": "neutral_mixed_unclear",
            "3": "positive",
            "4": "strongly_positive"
          },
          "probabilities": {
            "0": 0.002794298490249807,
            "1": 0.0011648369122301413,
            "2": 0.9948391718040579,
            "3": 0.0002945168940667179,
            "4": 0.0009071758993953115
          },
          "score": 1.9953554348001274,
          "type": "score"
        },
        "reports_product_defect": {
          "noul": 0.22270013882530884,
          "type": "noul"
        },
        "resolution_status": {
          "choice": "unresolved",
          "confidence": 0.8683560846071874,
          "probabilities": {
            "not_applicable": 0.006629980521496209,
            "partially_resolved": 0.08076969766270924,
            "resolved": 0.018022155574620568,